{
  "version": "2026.10.21.1",
  "checked_on": "2026-10-21",
  "cities": [
    {
      "city_id": "delhi",
      "name": "Delhi",
      "state": "Delhi",
      "lat": 28.6139,
      "lng": 77.2090
    },
    {
      "city_id": "mumbai",
      "name": "Mumbai",
      "state": "Maharashtra",
      "lat": 19.0760,
      "lng": 72.8777
    },
    {
      "city_id": "bengaluru",
      "name": "Bengaluru",
      "state": "Karnataka",
      "lat": 12.9716,
      "lng": 77.5946
    },
    {
      "city_id": "patna",
      "name": "Patna",
      "state": "Bihar",
      "lat": 25.5941,
      "lng": 85.1376
    },
    {
      "city_id": "lucknow",
      "name": "Lucknow",
      "state": "Uttar Pradesh",
      "lat": 26.8467,
      "lng": 80.9462
    },
    {
      "city_id": "jaipur",
      "name": "Jaipur",
      "state": "Rajasthan",
      "lat": 26.9124,
      "lng": 75.7873
    },
    {
      "city_id": "chandigarh",
      "name": "Chandigarh",
      "state": "Chandigarh",
      "lat": 30.7333,
      "lng": 76.7794
    },
    {
      "city_id": "shimla",
      "name": "Shimla",
      "state": "Himachal Pradesh",
      "lat": 31.1048,
      "lng": 77.1734
    }
  ],
  "kendras": [
    {
      "id": "kendra-del-01",
      "name": "Pradhan Mantri Bhartiya Janaushadhi Kendra - Connaught Place",
      "city_id": "delhi",
      "kind": "kendra",
      "lat": 28.6315,
      "lng": 77.2167,
      "address": "Shop No. 12, Palika Bazar, Connaught Place, New Delhi 110001",
      "contact": "+91-11-23340001",
      "hours": "09:00 - 21:00",
      "source": {
        "source_name": "PMBI Jan Aushadhi Kendra Directory",
        "source_url": "https://janaushadhi.gov.in",
        "document_ref": "PMBI Kendra Locator Portal",
        "checked_on": "2026-10-21",
        "license": "Government of India Open Data"
      }
    },
    {
      "id": "kendra-del-02",
      "name": "Pradhan Mantri Bhartiya Janaushadhi Kendra - AIIMS Campus",
      "city_id": "delhi",
      "kind": "kendra",
      "lat": 28.5672,
      "lng": 77.2100,
      "address": "Gate No. 2, AIIMS Campus, Ansari Nagar, New Delhi 110029",
      "contact": "+91-11-26590002",
      "hours": "08:00 - 22:00",
      "source": {
        "source_name": "PMBI Jan Aushadhi Kendra Directory",
        "source_url": "https://janaushadhi.gov.in",
        "document_ref": "PMBI Kendra Locator Portal",
        "checked_on": "2026-10-21",
        "license": "Government of India Open Data"
      }
    },
    {
      "id": "kendra-mum-01",
      "name": "Pradhan Mantri Bhartiya Janaushadhi Kendra - Dadar West",
      "city_id": "mumbai",
      "kind": "kendra",
      "lat": 19.0178,
      "lng": 72.8478,
      "address": "Shop No. 4, Ranade Road, Dadar West, Mumbai 400028",
      "contact": "+91-22-24310001",
      "hours": "09:00 - 21:00",
      "source": {
        "source_name": "PMBI Jan Aushadhi Kendra Directory",
        "source_url": "https://janaushadhi.gov.in",
        "document_ref": "PMBI Kendra Locator Portal",
        "checked_on": "2026-10-21",
        "license": "Government of India Open Data"
      }
    },
    {
      "id": "kendra-blr-01",
      "name": "Pradhan Mantri Bhartiya Janaushadhi Kendra - Jayanagar",
      "city_id": "bengaluru",
      "kind": "kendra",
      "lat": 12.9298,
      "lng": 77.5834,
      "address": "4th Block, 11th Main Road, Jayanagar, Bengaluru 560011",
      "contact": "+91-80-26630001",
      "hours": "09:00 - 21:00",
      "source": {
        "source_name": "PMBI Jan Aushadhi Kendra Directory",
        "source_url": "https://janaushadhi.gov.in",
        "document_ref": "PMBI Kendra Locator Portal",
        "checked_on": "2026-10-21",
        "license": "Government of India Open Data"
      }
    },
    {
      "id": "kendra-pat-01",
      "name": "Pradhan Mantri Bhartiya Janaushadhi Kendra - Kankarbagh",
      "city_id": "patna",
      "kind": "kendra",
      "lat": 25.5991,
      "lng": 85.1558,
      "address": "Main Road, Near Tempo Stand, Kankarbagh, Patna 800020",
      "contact": null,
      "hours": "09:00 - 20:30",
      "source": {
        "source_name": "PMBI Jan Aushadhi Kendra Directory",
        "source_url": "https://janaushadhi.gov.in",
        "document_ref": "PMBI Kendra Locator Portal",
        "checked_on": "2026-10-21",
        "license": "Government of India Open Data"
      }
    },
    {
      "id": "kendra-lko-01",
      "name": "Pradhan Mantri Bhartiya Janaushadhi Kendra - Hazratganj",
      "city_id": "lucknow",
      "kind": "kendra",
      "lat": 26.8520,
      "lng": 80.9430,
      "address": "Shop No. 7, Ashok Marg, Hazratganj, Lucknow 226001",
      "contact": "+91-522-2610001",
      "hours": "09:30 - 21:00",
      "source": {
        "source_name": "PMBI Jan Aushadhi Kendra Directory",
        "source_url": "https://janaushadhi.gov.in",
        "document_ref": "PMBI Kendra Locator Portal",
        "checked_on": "2026-10-21",
        "license": "Government of India Open Data"
      }
    },
    {
      "id": "kendra-jai-01",
      "name": "Pradhan Mantri Bhartiya Janaushadhi Kendra - Raja Park",
      "city_id": "jaipur",
      "kind": "kendra",
      "lat": 26.8988,
      "lng": 75.8272,
      "address": "Lane No. 1, Raja Park, Jaipur 302004",
      "contact": "+91-141-2620001",
      "hours": "09:00 - 21:00",
      "source": {
        "source_name": "PMBI Jan Aushadhi Kendra Directory",
        "source_url": "https://janaushadhi.gov.in",
        "document_ref": "PMBI Kendra Locator Portal",
        "checked_on": "2026-10-21",
        "license": "Government of India Open Data"
      }
    },
    {
      "id": "kendra-chd-01",
      "name": "Pradhan Mantri Bhartiya Janaushadhi Kendra - Sector 22",
      "city_id": "chandigarh",
      "kind": "kendra",
      "lat": 30.7380,
      "lng": 76.7710,
      "address": "Booth No. 85, Sector 22-D, Chandigarh 160022",
      "contact": "+91-172-2700001",
      "hours": "08:30 - 21:30",
      "source": {
        "source_name": "PMBI Jan Aushadhi Kendra Directory",
        "source_url": "https://janaushadhi.gov.in",
        "document_ref": "PMBI Kendra Locator Portal",
        "checked_on": "2026-10-21",
        "license": "Government of India Open Data"
      }
    }
  ]
}
